{
  "schema_version": "2.0",
  "project_id": "NINEL",
  "source_context": {
    "scenes": [
      {
        "scene_id": "NINEL-E01-SC001",
        "source_reference": "SRC-S01"
      },
      {
        "scene_id": "NINEL-E02-SC001",
        "source_reference": "SRC-S01"
      }
    ],
    "shots": [
      {
        "scene_id": "NINEL-E01-SC001",
        "shot_id": "NINEL-E01-SC001-SH001",
        "supplied_facts": [
          {
            "category": "visual",
            "value": "A cyan holographic star map hovers above the console.",
            "source_reference": "SRC-SH001-VISUAL"
          },
          {
            "category": "camera",
            "value": "A slow 30 cm push-in ends on Ninel's hand beneath the map.",
            "source_reference": "SRC-SH001-CAMERA"
          },
          {
            "category": "lens",
            "value": "40 mm lens.",
            "source_reference": "SRC-SH001-LENS"
          },
          {
            "category": "lighting",
            "value": "Warm console practicals contrast with cyan interactive light from the map.",
            "source_reference": "SRC-SH001-LIGHTING"
          },
          {
            "category": "performance",
            "value": "Ninel flinches when the map glitches.",
            "source_reference": "SRC-SH001-PERFORMANCE"
          }
        ]
      },
      {
        "scene_id": "NINEL-E01-SC001",
        "shot_id": "NINEL-E01-SC001-SH002",
        "supplied_facts": [
          {
            "category": "visual",
            "value": "Ninel and Ivo exchange the brass key across the console.",
            "source_reference": "SRC-SH002-VISUAL"
          },
          {
            "category": "camera",
            "value": "Locked medium two-shot.",
            "source_reference": "SRC-SH002-CAMERA"
          },
          {
            "category": "lens",
            "value": "40 mm lens.",
            "source_reference": "SRC-SH002-LENS"
          },
          {
            "category": "lighting",
            "value": "Only the warm console practicals light the exchange.",
            "source_reference": "SRC-SH002-LIGHTING"
          },
          {
            "category": "performance",
            "value": "The exchange is performed entirely in camera.",
            "source_reference": "SRC-SH002-PERFORMANCE"
          }
        ]
      },
      {
        "scene_id": "NINEL-E02-SC001",
        "shot_id": "NINEL-E02-SC001-SH001",
        "supplied_facts": [
          {
            "category": "visual",
            "value": "Ninel and Ivo exchange the brass key across the console.",
            "source_reference": "SRC-SH002-VISUAL"
          },
          {
            "category": "camera",
            "value": "Locked medium two-shot.",
            "source_reference": "SRC-SH002-CAMERA"
          },
          {
            "category": "lens",
            "value": "40 mm lens.",
            "source_reference": "SRC-SH002-LENS"
          },
          {
            "category": "lighting",
            "value": "Only the warm console practicals light the exchange.",
            "source_reference": "SRC-SH002-LIGHTING"
          },
          {
            "category": "performance",
            "value": "The exchange is performed entirely in camera.",
            "source_reference": "SRC-SH002-PERFORMANCE"
          }
        ]
      },
      {
        "scene_id": "NINEL-E02-SC001",
        "shot_id": "NINEL-E02-SC001-SH002",
        "supplied_facts": [
          {
            "category": "visual",
            "value": "Ninel and Ivo exchange the brass key across the console.",
            "source_reference": "SRC-SH002-VISUAL"
          },
          {
            "category": "camera",
            "value": "Locked medium two-shot.",
            "source_reference": "SRC-SH002-CAMERA"
          },
          {
            "category": "lens",
            "value": "40 mm lens.",
            "source_reference": "SRC-SH002-LENS"
          },
          {
            "category": "lighting",
            "value": "Only the warm console practicals light the exchange.",
            "source_reference": "SRC-SH002-LIGHTING"
          },
          {
            "category": "performance",
            "value": "The exchange is performed entirely in camera.",
            "source_reference": "SRC-SH002-PERFORMANCE"
          }
        ]
      }
    ]
  },
  "applicability": [
    {
      "shot_id": "NINEL-E01-SC001-SH001",
      "classification": "effect",
      "effect_ids": [
        "NINEL-FX001"
      ],
      "reason": "The supplied hologram requires an integration plan."
    },
    {
      "shot_id": "NINEL-E01-SC001-SH002",
      "classification": "no-vfx",
      "effect_ids": [],
      "reason": "The supplied exchange is entirely in camera."
    },
    {
      "shot_id": "NINEL-E02-SC001-SH001",
      "classification": "no-vfx",
      "effect_ids": [],
      "reason": "The supplied exchange is entirely in camera."
    },
    {
      "shot_id": "NINEL-E02-SC001-SH002",
      "classification": "no-vfx",
      "effect_ids": [],
      "reason": "The supplied exchange is entirely in camera."
    }
  ],
  "effects": [
    {
      "effect_id": "NINEL-FX001",
      "shot_ids": [
        "NINEL-E01-SC001-SH001"
      ],
      "uncertainty_ids": [
        "NINEL-UNC001"
      ],
      "dramatic_purpose": "Make the map glitch trigger Ninel's flinch.",
      "visual_purpose": "Read as a cyan map hovering above the console.",
      "decomposition": [
        "map volume",
        "glitch event",
        "hand occlusion"
      ],
      "practical_digital_boundary": {
        "status": "unresolved",
        "practical_scope": "Cyan interactive light may be photographed.",
        "digital_scope": "The map and glitch remain digital candidates.",
        "uncertainty_id": "NINEL-UNC001"
      },
      "clean_plate": {
        "decision": "required",
        "reason": "Preserve the console behind the map and hand."
      },
      "tracking": {
        "decision": "required",
        "requirements": [
          "Record the push-in and console reference points."
        ]
      },
      "camera_lens_lighting_metadata": [
        {
          "shot_id": "NINEL-E01-SC001-SH001",
          "category": "camera",
          "value": "A slow 30 cm push-in ends on Ninel's hand beneath the map.",
          "source_reference": "SRC-SH001-CAMERA",
          "provenance_status": "supplied"
        },
        {
          "shot_id": "NINEL-E01-SC001-SH001",
          "category": "lens",
          "value": "40 mm lens.",
          "source_reference": "SRC-SH001-LENS",
          "provenance_status": "supplied"
        },
        {
          "shot_id": "NINEL-E01-SC001-SH001",
          "category": "lighting",
          "value": "Warm console practicals contrast with cyan interactive light from the map.",
          "source_reference": "SRC-SH001-LIGHTING",
          "provenance_status": "supplied"
        }
      ],
      "mattes_holdouts": [
        "Preserve Ninel's hand as a foreground holdout."
      ],
      "reference_capture": [
        "Capture console and hand spatial reference."
      ],
      "practical_interaction": [
        "Retain or recreate cyan response on hand and console."
      ],
      "simulation": {
        "status": "not-required",
        "requirements": [],
        "uncertainty_id": null
      },
      "capture_generation_elements": [
        "clean console plate",
        "map design reference"
      ],
      "integration_assumptions": [
        "Map placement remains fixed to the console."
      ],
      "continuity": [
        "Glitch timing remains synchronized with Ninel's flinch."
      ],
      "dependencies": [
        {
          "dependency": "Approve the practical/digital boundary.",
          "owner": "human VFX and photography leads"
        }
      ],
      "human_safety_handoff": {
        "required": true,
        "review": "A qualified human safety lead reviews any on-set emitter or marker plan."
      },
      "acceptance_criteria": [
        "The cyan map hovers without tracking drift.",
        "The glitch remains synchronized with Ninel's flinch."
      ]
    }
  ],
  "assumptions": [
    "Map placement is proposed pending review."
  ],
  "approval_evidence": [],
  "supplied_boundary_evidence": [],
  "uncertainties": [
    {
      "uncertainty_id": "NINEL-UNC001",
      "description": "The practical-versus-digital interaction method is unresolved.",
      "effect_ids": [
        "NINEL-FX001"
      ],
      "shot_ids": [
        "NINEL-E01-SC001-SH001"
      ],
      "owner": "human VFX and photography leads"
    }
  ]
}
